{
  "benchmark": "personal-ai-sovereignty-benchmark",
  "version": "1.0.0-rc.0",
  "generatedAt": "2026-05-23T00:00:00.000Z",
  "items": [
    {
      "id": "runnable-demo",
      "status": "ready",
      "evidence": "README.md, src/ui/App.tsx, pnpm dev",
      "note": "Local Vite demo presents scenario, trace, consent, risks, and scorecard."
    },
    {
      "id": "deterministic-eval-harness",
      "status": "ready",
      "evidence": "src/evals/cli.ts, outputs/sample_eval_report.md",
      "note": "Deterministic run log, scorecards, baseline comparison, enforcement probes, coverage, validity, and adversarial checks regenerate with pnpm eval."
    },
    {
      "id": "schema-contracts",
      "status": "ready",
      "evidence": "schemas/",
      "note": "Scenario, scoring, benchmark-card, threat-model, annotation, annotation-agreement, baseline-submission, external-trace, broker-attestation, sandboxed-trace-runner, submitted-artifact-runner, external-validation-gate, transcript, adversarial execution, statistics, runtime, signed consent, key custody, process-egress guard, container confinement, scorecard-stress, aggregate-attack, executable aggregate-attack, aggregate privacy challenge, and release-packet artifacts are schema-backed."
    },
    {
      "id": "real-local-model-evidence",
      "status": "ready",
      "evidence": "outputs/model_transcript_eval_multimodel.md, outputs/adversarial_prompt_execution_multimodel.md",
      "note": "One reproducible sweep over three real Ollama models (gemma4:26b, qwen3:4b, llama3.2:3b) exists. A stronger v1.0 claim still needs more capable external agent implementations and independent runs."
    },
    {
      "id": "egress-enforcement-simulation",
      "status": "ready",
      "evidence": "outputs/enforcement_report.md, src/privacy/egressGuard.ts",
      "note": "Executable probes cover raw protected egress, active consent, revoked consent, expired consent, retention deadlines, and aggregate release."
    },
    {
      "id": "storage-backed-runtime-enforcement",
      "status": "ready",
      "evidence": "outputs/runtime_enforcement_report.md, src/privacy/consentLedger.ts, src/privacy/sovereignFetch.ts",
      "note": "Application-level fetch mediation uses a file-backed consent ledger and audit log to prove blocked egress does not execute the outbound call."
    },
    {
      "id": "process-level-egress-guard",
      "status": "ready",
      "evidence": "outputs/process_egress_guard_report.md, src/privacy/processEgressGuard.ts",
      "note": "A guarded child process preloads network hooks that trap Fetch, HTTP, HTTPS, raw TCP, and TLS egress attempts before untrusted benchmark code executes."
    },
    {
      "id": "signed-consent-receipts",
      "status": "ready",
      "evidence": "outputs/signed_consent_report.md, src/privacy/signedConsentReceipt.ts",
      "note": "Keyed consent receipts separate cryptographic integrity from scoped policy validity across valid, tampered, revoked, and mismatched attempts."
    },
    {
      "id": "key-custody-lifecycle",
      "status": "ready",
      "evidence": "outputs/key_custody_report.md, src/privacy/keyCustody.ts",
      "note": "Deterministic key lifecycle probes cover rotation, retirement, revocation, historical verification, envelope tampering, and event-log hash-chain tampering without claiming production key custody."
    },
    {
      "id": "artifact-reproducibility",
      "status": "ready",
      "evidence": "outputs/artifact_manifest.md, Dockerfile, .devcontainer/devcontainer.json",
      "note": "Public artifacts are SHA-256 hashed and can be regenerated and verified with the local gate."
    },
    {
      "id": "construct-validity-scaffold",
      "status": "ready",
      "evidence": "outputs/construct_validity_report.md, outputs/scenario_coverage_report.md",
      "note": "Local checks cover baseline separability, adversarial calibration, enforcement probes, score-weight robustness, scenario coverage, and the remaining human-label blocker."
    },
    {
      "id": "executable-tool-traces",
      "status": "ready",
      "evidence": "outputs/tool_trace_report.md, src/agent/toolAgent.ts",
      "note": "In-process tool adapters produce auditable local search, consented tool-call, aggregate, and unsafe raw-egress traces."
    },
    {
      "id": "aggregate-risk-stress-test",
      "status": "ready",
      "evidence": "outputs/aggregate_risk_report.md, outputs/aggregate_attack_report.md, outputs/aggregate_empirical_attack_report.md, outputs/executable_aggregate_attack_report.md, outputs/aggregate_privacy_challenge_report.md, src/privacy/aggregateRisk.ts",
      "note": "Synthetic aggregate candidates receive linkability controls or blocks, then face attack-shaped linkage, auxiliary-context, differencing, cohort-uniqueness, executable fixture-attack, and semi-realistic target-inference pressure."
    },
    {
      "id": "os-network-confinement-probe",
      "status": "ready",
      "evidence": "outputs/os_network_confinement_probe.md, .github/workflows/os-confinement.yml",
      "note": "Local macOS sandbox evidence exists and a public macOS workflow runs the probe."
    },
    {
      "id": "container-network-confinement-probe",
      "status": "partial",
      "evidence": "outputs/container_network_confinement_probe.md, .github/workflows/container-confinement.yml",
      "note": "Docker network-none evidence gives a Linux/container confinement counterpart; it is still a probe, not a production broker or complete sandbox policy."
    },
    {
      "id": "scorecard-stress-testing",
      "status": "ready",
      "evidence": "outputs/scorecard_stress_report.md, src/evals/scorecardStressReport.ts",
      "note": "Author-defined scoring is now checked for negative-control separation, local-only usefulness penalty, and ceiling-effect risk before external validation."
    },
    {
      "id": "annotation-agreement-pipeline",
      "status": "partial",
      "evidence": "outputs/annotation_agreement_report.md, schemas/annotation-agreement-report.schema.json",
      "note": "Annotation aggregation and agreement metrics are executable, but checked-in data is only a seed example and remains insufficient."
    },
    {
      "id": "baseline-submission-pipeline",
      "status": "partial",
      "evidence": "outputs/baseline_submission_report.md, schemas/baseline-submission.schema.json",
      "note": "Baseline submission contract exists, but independent production-agent submissions remain absent."
    },
    {
      "id": "external-trace-evaluator",
      "status": "partial",
      "evidence": "outputs/external_trace_evaluation_report.md, schemas/external-agent-trace.schema.json",
      "note": "External agent traces can be normalized into boundary, consent, and aggregate-control findings, but checked-in traces are seed fixtures."
    },
    {
      "id": "broker-attestation-layer",
      "status": "partial",
      "evidence": "outputs/broker_attestation_report.md, src/broker/traceBroker.ts",
      "note": "Submitted traces are replayed through a deterministic broker and signed as execution/block attestations, but this is still local benchmark mediation rather than production broker execution."
    },
    {
      "id": "sandboxed-trace-runner",
      "status": "partial",
      "evidence": "outputs/sandboxed_trace_runner_report.md, src/broker/sandboxedTraceRunner.ts",
      "note": "Broker-approved trace actions execute in a guarded child process and direct escape attempts are denied; this is stronger than replay-only evidence but still not production sandboxing."
    },
    {
      "id": "submitted-artifact-runner",
      "status": "partial",
      "evidence": "outputs/submitted_artifact_runner_report.md, examples/submitted_artifacts/, src/evals/submittedArtifactRunnerReport.ts",
      "note": "Fixture submitted artifacts now emit traces under a reproducible contract, source digests are bound to signed receipts, broker/sandbox attestations are preserved, and Docker hardened-profile probes run when available."
    },
    {
      "id": "external-validation-gate",
      "status": "partial",
      "evidence": "outputs/external_validation_gate.md, schemas/external-validation-gate.schema.json",
      "note": "Release gate combines annotation, baseline, and aggregate-attack blockers; it remains blocked until external evidence exists."
    },
    {
      "id": "external-human-annotation",
      "status": "blocked_external",
      "evidence": "outputs/annotation_packet.md, outputs/inter_rater_report.md",
      "note": "Annotation packet exists, but independent reviewers have not yet scored overlapping cases."
    },
    {
      "id": "public-launch-readiness",
      "status": "partial",
      "evidence": "outputs/v0.18_release_packet.md",
      "note": "Ready as a 1.0.0-rc.0 benchmark-scaffold release candidate carrying forward the v0.18 evidence lineage; not ready to claim validated public standard."
    }
  ]
}
